,Opening,Opening.1,Title,Director,Cast,Studio (production house),Ref.
0,JAN,1.0,Ghost Stories,Karan JoharDibakar BanerjeeZoya AkhtarAnurag Kashyap,Sobhita DhulipalaMrunal ThakurAvinash TiwaryJanhvi KapoorSurekha SikriRaghuvir YadavGulshan DevaiahVijay VarmaPavail GulatiJyoti SubhashEva Ameet PardeshiKitu GidwaniSumit Tandon,"RSVP Movies, Flying Unicorn Entertainment, Netflix",[16]
1,JAN,3.0,Bhangra Paa Le,Sneha Taurani,Sunny KaushalRukshar DhillonShriya Pilgaonkar,RSVP Movies,[17]
2,JAN,3.0,Sab Kushal Mangal,Karan Vishwanath Kashyap,Akshaye KhannaRiva KishanPriyank Sharma,One Up Entertainment,[18]
3,JAN,3.0,Shimla Mirchi,Ramesh Sippy,Hema MaliniRajkummar RaoRakul Preet Singh,Viacom18 Motion Pictures,[19]
4,JAN,6.0,Half Widow,Danish Renzu,Neelofar HamidShahnawaz BhatMir SarwarHaseena Sofi,"Renzu Films, Gaya Art Films",[20]
5,JAN,10.0,Chhapaak,Meghna Gulzar,Deepika PadukoneVikrant Massey,"Fox Star Studios, Ka Productions, Mriga Films",[21]
6,JAN,10.0,Tanhaji,Om Raut,Ajay DevgnSaif Ali KhanKajolSharad Kelkar,"Ajay Devgn FFilms, T-Series",[22]
7,JAN,17.0,Bunker,Jugal Raja,Abhijeet SinghArindita Kalita,Wagging Tail Entertainment,[23]
8,JAN,17.0,Jai Mummy Di,Navjot Gulati,Sunny SinghSonnalli SeygallPoonam DhillonSupriya Pathak,"Luv Films, T-Series",[24]
9,JAN,24.0,Panga,Ashwiny Iyer Tiwari,Kangana RanautJassi GillRicha ChadhaNeena Gupta,Fox Star Studios,[25]
10,JAN,24.0,Street Dancer 3D,Remo D'Souza,Varun DhawanShraddha KapoorPrabhu DevaNora FatehiAparshakti KhuranaMurali SharmaRaghav JuyalDharmesh YelandePunit PathakJigar RupareliyaSonam Bajwa,"T-Series, Remo D'Souza Entertainment",[26]
11,JAN,31.0,Gul Makai,H.E. Amjad khan,Reem ShaikhAtul KulkarniDivya DuttaOm PuriArif ZakariaMukesh RishiAbhimanyu SinghPankaj Tripathi,Pen India Limited,[27]
12,JAN,31.0,Happy Hardy and Heer,Raka,Himesh ReshammiyaSonia Mann,"HR Musik Limited, EYKA Films",[28]
13,JAN,31.0,Jawaani Jaaneman,Nitin Kakkar,Saif Ali KhanTabuAlaya Furniturewala,Pooja Entertainment,[29]
14,JAN,31.0,Pagleaazam,"Vikas P Kavvthekaar, Aps Raghuvanshi",Aditya Pratap SinghMandeep Kaur MannnatSonia SharmaLiliputFaruqueRavi MannAbhinaye SharmaSahil PatelAmber Upadhyay,Aps Entertainment,[30]
15,FEB,4.0,Operation Parindey,Sanjay Gadhvi,Amit SadhRahul DevAakash DahiyaRucha Inamdar,"Final Coast, Fluence Studios, Roll Kamera Motion Pictures, ZEE5",[31]
16,FEB,7.0,Hacked,Vikram Bhatt,Hina KhanRohan ShahMohit MalhotraSid Makkar,Zee Studios,[32]
17,FEB,7.0,Kaanchli Life in a Slough,Dedipya Joshii,Sanjay MishraShikha Malhotra,Pisceann Pictures,[33]
18,FEB,7.0,Malang,Mohit Suri,Aditya Roy KapurDisha PataniAnil KapoorElli AvrRamAmruta Khanvilkar,"T-Series, Luv Films",[34]
19,FEB,7.0,Yahan Sabhi Gyani Hain,Anant Tripathi,Neeraj SoodApoorva AroraAtul Srivastav,"Ulterior Vision Production Private Limited, The Future Films",[35]
20,FEB,7.0,Shikara,Vidhu Vinod Chopra,Aadil KhanSadia Khateeb,"Vinod Chopra Films, Fox Star Studios",[36]
21,FEB,14.0,Khawab Sare Jhoothey,Deepak Baldev Thakur,Harsh KumarTullika Singh,"Glitters Film Academy, AG Entertainment",[37]
22,FEB,14.0,Love Aaj Kal,Imtiaz Ali,Kartik AaryanSara Ali KhanRandeep Hooda,"Jio Studios, Maddock Films, Reliance Entertainment, Window Seat Films",[38]
23,FEB,14.0,Shukranu,Bishnu Dev Halder,DivyennduShweta Basu PrasadSheetal Thakur,"Reliance Entertainment, ZEE5",[39]
24,FEB,21.0,Bhoot – Part One: The Haunted Ship,Bhanu Pratap Singh,Vicky KaushalBhumi Pednekar,Dharma Productions,[40]
25,FEB,21.0,The Hundred Bucks,Dushyant Pratap Singh,Kavita TripathiDinesh BawraJaid Shaikh,Dushyant Corporation,[41][42]
26,FEB,21.0,Shubh Mangal Zyada Saavdhan,Hitesh Kewalya,Ayushmann KhurranaJitendra KumarGajraj RaoNeena GuptaManurishi ChaddhaSunita RajwarMaanvi GagrooPankhuri AwasthyNeeraj Singh,"Colour Yellow Productions, T-Series",[43]
27,FEB,21.0,Yeh Ballet,Sooni Taraporevala,Julian SandsAchintya BoseManish Chauhan,"Roy Kapur Films, Netflix",[44]
28,FEB,28.0,Doordarshan,Gagan Puri,Mahie GillManu Rishi ChaddhaDolly AhluwaliaSupriya ShuklaRajesh SharmaMehak ManwaniSumit Gulati,"Arya Films, UFO Moviez",[45]
29,FEB,28.0,Guns of Banaras,Sekhar Suri,Karan NathNathalia KaurAbhimanyu SinghGanesh VenkatramanShilpa ShirodkarZarina WahabMohan AgasheTej Sapru,"AJ Media Corp, Dashaka Cinema Co Production",[46]
30,FEB,28.0,Haunted Hills,Sanjeev Kumar Rajput,Zuber K. KhanDiana Khan,"RSBS Films, UFO Moviez",[47]
31,FEB,28.0,O Pushpa I Hate Tears,Dinkar Kapoor,Krushna AbhishekKarthik JayaramArjumman Mughal,"Films@50, Wavelength Studios",[48]
32,FEB,28.0,Thappad,Anubhav Sinha,Taapsee PannuPavail GulatiMaya SaraoNaila Grewal,"Benaras Media Works, T-Series",[49]
33,MAR,2.0,Dheet Patangey,Ravi Adhikari,Shivin NarangChandan Roy SanyalAli MuradHardik SanghaniTillotama ShomePriya Banerjee,"Happi Digital, Hotstar",[50]
34,MAR,6.0,Baaghi 3,Ahmed Khan,Tiger ShroffRiteish DeshmukhShraddha KapoorAnkita Lokhande,"Nadiadwala Grandson Entertainment, Fox Star Studios",[51]
35,MAR,6.0,Guilty,Ruchi Narain,Kiara AdvaniAkansha Ranjan KapoorGurfateh Singh PirzadaTaher ShabbirDalip TahilKunal VijaykarManu RishiJanya JoshiChayan Chopra,"Dharmatic, Netflix",[52]
36,MAR,6.0,Kaamyaab,Hardik Mehta,Sanjay MishraDeepak Dobriyal,"Red Chillies Entertainment, Drishyam Films",[53]
37,MAR,13.0,Angrezi Medium,Homi Adajania,Irrfan KhanKareena KapoorRadhika MadanDeepak DobriyalPankaj Tripathi,Maddock Films,[54]
38,MAR,27.0,Maska,Neeraj Udhwani,Manisha KoiralaNikita DuttaJaved JaffreyPrit KamaniShirley Setia,"Mutant Films, Netflix",[55]
39,APR,10.0,Bamfaad,Ranjan Chandel,Aditya RawalShalini PandeyVijay Varma,"JAR Pictures, ZEE5",[58]
40,APR,21.0,Ateet,Tanuj Bhramar,PriyamaniSanjay SuriRajeev Khandelwal,"Funtime Entertainment, Indian Film Studios, ZEE5",[59]
41,MAY,1.0,Mrs. Serial Killer,Shirish Kunder,Jacqueline FernandezManoj BajpayeeMohit RainaZayn Marie,"Three's Company Productions Pvt.Ltd, Netflix",[60]
42,MAY,6.0,Court Martial,Sourabh Srivastava,Rajeev KhandelwalSaksham DaymaSwapnil Kotiwar,"Iris Productions, Zee Theatre",[61]
43,MAY,20.0,What Are the Odds,Megha Ramaswamy,Yashaswini DayamaKaranvir MalhotraAbhay Deol,"FilmKaravan, Netflix",[62]
44,MAY,22.0,Ghoomketu,Pushpendra Nath Misra,Nawazuddin SiddiquiRagini KhannaRicha ChadhaAnurag KashyapDeepika AminRaghuvir YadavIla ArunSwanand Kirkire,"Phantom Films, Sony Pictures, ZEE5",[63]
45,JUN,1.0,Chippa,Safdar Rehman,Sunny PawarJoyraj BhattacharyaSumeet ThakurGautam SarkarMasood AkhtarKalpan Mitra,"Traveling Light Pictures, Ultra Media & Entertainment, Victory Media, Wishberry Films",[64]
46,JUN,5.0,Chintu Ka Birthday,Devanshu KumarSatyanshu Singh,Vinay PathakTillotama ShomeNate Scholz,"Final Draft, ZEE5",[65]
47,JUN,5.0,Choked,Anurag Kashyap,Saiyami KherRoshan MathewAmruta SubhashRajshri Deshpande,"JAR Pictures, Good Bad Films, Netflix",[66]
48,JUN,12.0,Axone,Nicholas Kharkongor,Dolly AhluwaliaSayani GuptaTenzin DalhaVinay PathakLin LaishramAsenla JamirLanuakum Ao,"Saregama India, Yoodlee films",[67]
49,JUN,12.0,Gulabo Sitabo,Shoojit Sircar,Farrukh JaffarAmitabh BachchanAyushmann KhurranaVijay RaazBrijendra KalaNalneesh Neel,"Rising Sun Films, Kino Works, Amazon Prime Video",[68]
50,JUN,18.0,Kadakh,Rajat Kapoor,Kalki KoechlinRanvir ShoreyShruti SethManoj PahwaTara SharmaCyrus SahukarMansi Multani,"Mithya Talkies, Sony LIV",[69]
51,JUN,19.0,Chaman Bahaar,Apurva Dhar Badgaiyann,Jitendra KumarRitika Badiani,"Saregama India, Yoodlee films",[70]
52,JUN,24.0,Bulbbul,Anvita Dutt,Tripti DimriAvinash TiwaryRahul BoseParambrata ChatterjeePaoli Dam,"Clean Slate Films, Netflix",[71]
53,JUN,26.0,Bhonsle,Devashish Makhija,Manoj BajpayeeSantosh JuvekarIpshita Chakraborty SinghAbhishek Banerjee,"Muvizz, Sony LIV",[72]
54,JUN,27.0,Unlock,Debatma Mandal,Kushal TandonHina KhanRishabh SinhaAditi Arya,"Krasnaya Corporation, Wind Horse Films, ZEE5",[73]
55,JUL,16.0,Virgin Bhanupriya,Ajay Lohan,Urvashi RautelaGautam Gulati,"Dhariwal Films, ZEE5",[74]
56,JUL,24.0,Dil Bechara,Mukesh Chhabra,Sushant Singh RajputSanjana SanghiSaif Ali Khan,"Fox Star Studios, Disney+ Hotstar",[75]
57,JUL,30.0,Yaara,Tigmanshu Dhulia,Vidyut JammwalShruti HaasanAmit SadhVijay VarmaKenny Basumatary,"Tigmanshu Dhulia Films, Azure Entertainment, ZEE5",[76]
58,JUL,31.0,Shakuntala Devi,Anu Menon,Vidya BalanJisshu SenguptaSanya MalhotraAmit Sadh,"Abundantia Entertainment, Sony Pictures Networks India, A Genius Films Production, Amazon Prime Video",[77]
59,JUL,31.0,Lootcase,Rajesh Krishnan,Kunal KhemuRasika DugalVijay RaazRanvir ShoreyGajraj RaoAryan PrajapatiShashi RanjanSumit Nijhawan,"Fox Star Studios, Soda Films, Disney+ Hotstar",[78]
60,JUL,31.0,Raat Akeli Hai,Honey Trehan,Nawazuddin SiddiquiRadhika ApteShweta TripathiIla ArunShivani RaghuvanshiAditya SrivastavaTigmanshu DhuliaSwanand Kirkire,"RSVP Movies, Netflix",[79]
61,AUG,6.0,Pareeksha,Prakash Jha,Adil HussainPriyanka BoseSanjay Suri,"Prakash Jha Productions, ZEE5",[80]
62,AUG,12.0,Gunjan Saxena: The Kargil Girl,Sharan Sharma,Janhvi KapoorPankaj TripathiAngad BediVineet Kumar SinghManav Vij,"Dharma Productions, Zee Studios, Netflix",[81]
63,AUG,14.0,Khuda Haafiz,Faruk Kabir,Vidyut JammwalShivaleeka OberoiAnnu KapoorShiv PandittAahana Kumra,"Panorama Studios, Disney+ Hotstar",[82]
64,AUG,21.0,Captain Vidyut,Atish Tipathi,Namit DasSuresh MenonTrisha KaleRaghuvir Yadav,Parijat Animation Films,[83]
65,AUG,21.0,Class of '83,Atul Sabharwal,Bobby DeolBhupendra JadawatHitesh BhojrajAnup SoniJoy SenguptaSameer ParanjapeNinad MahajaniPrithvik Pratap,"Red Chillies Entertainment, Netflix",[84]
66,AUG,21.0,Mee Raqsam,Baba Azmi,Naseeruddin ShahDanish HusainAditi SubediShradha KaulRakesh Chaturvedi,"AZMI Pictures, ZEE5",[85]
67,AUG,28.0,Sadak 2,Mahesh Bhatt,Sanjay DuttPooja BhattAlia BhattAditya Roy Kapur,"Vishesh Films, Fox Star Studios, Disney+ Hotstar",[86]
68,AUG,28.0,Ram Singh Charlie,Nitin Kakkar,Kumud MishraDivya DuttaAkarsh KhuranaFarrukh SeyerSalima RazaRohit Rokhade,"Little Too Much Productions, Sony Liv",[87]
69,SEP,5.0,Atkan Chatkan,Shiv Hare,Sachin ChaudharyYash RaneTamanna Dipak,"Lokaa Entertainment, ZEE5",[88]
70,SEP,9.0,Cargo,Arati Kadav,Vikrant MasseyShweta Tripathi,"Fundamental Pictures, Electric Films, Netflix",[89]
71,SEP,18.0,Dolly Kitty Aur Woh Chamakte Sitare,Alankrita Shrivastava,Konkona Sen SharmaBhumi PednekarAmol ParasharAamir BashirKubbra SaitKaran KundraVikrant MasseyMushtaq Khan,"Balaji Motion Pictures, ALT Entertainment, Netflix",[90]
72,SEP,18.0,London Confidential,Kanwal Sethi,Mouni RoyPurab KohliKulraj RandhawaSagar AryaParvesh RanaJas BinagDiljohn SinghKiren Jog,"JAR Pictures, ZEE5",[91]
73,SEP,21.0,Halahal,Randeep Jha,Sachin KhedekarBarun Sobti,"Eros International, Eros Now",[92]
74,21,,,,,,
75,OCT,2.0,Khaali Peeli,Maqbool Khan,Ishaan KhatterAnanya PandayJaideep Ahlawat,"Zee Studios, Offside Entertainment, Zee Plex, ZEE5",[93]
76,OCT,2.0,Serious Men,Sudhir Mishra,Nawazuddin SiddiquiAakshath DasShweta Basu PrasadNassarIndira Tiwari,"Bombay Fables, Cineraas Entertainment, Netflix",[94]
77,OCT,2.0,Bahut Hua Samman,Ashish R Shukla,Raghav JuyalAbhishek ChauhanSanjay MishraRam KapoorNidhi SinghNamit DasFlora Saini,"Yoodlee films, Disney+ Hotstar",[95]
78,OCT,9.0,Ginny Weds Sunny,Puneet Khanna,Yami GautamVikrant Massey,"Soundrya Production, Netflix",[96]
79,OCT,16.0,The Pickup Artist,Rohit Arora,Dev ChauhanPankaj Uniyal,Roar Picture Company,[97]
80,OCT,21.0,Comedy Couple,Nachiket Samant,Saqib SaleemShweta Basu Prasad,"Yoodlee films, ZEE5",[98]
81,OCT,23.0,Kasaai,Gajendra Shrotriya,Mita VasishtMayur MoreAmit Bimrot,ShemarooMe,[99]
82,OCT,29.0,Taish,Bejoy Nambiar,Pulkit SamratKriti KharbandaJim SarbhHarshvardhan RaneZoa MoraniSanjeeda SheikhAbhimanyu SinghAnkur Rathee,"Ease My Trip, Getaway Pictures Presentation, A Crayon Films Production, ZEE5",[100]
83,OCT,30.0,Kaali Khuhi,Terrie Samundra,Shabana AzmiSatyadeep MishraRiva AroraSanjeeda Sheikh,"Manomay Motion Pictures, Netflix",[101]
84,NOV,6.0,Pepper Chicken,Ratan Sil Ram,Dipannita SharmaBoloram DasBaharul IslamRavi SarmaMonuj Borkotoky,"RKZ Films, North-East Film Studio, ShemarooMe",[102]
85,NOV,9.0,Laxmii,Raghava Lawrence,Akshay KumarKiara Advani,"Cape of Good Films, Fox Star Studios, Shabinaa Entertainment, Tushar Entertainment House, Disney+ Hotstar",[103]
86,NOV,12.0,Ludo,Anurag Basu,Abhishek BachchanRajkummar RaoAditya Roy KapurFatima Sana ShaikhSanya MalhotraPankaj TripathiRohit Suresh SarafPearle MaaneyAsha NegiInayat VermaShalini Vats,"T-Series, Anurag Basu Productions, Netflix",[104]
87,NOV,13.0,Chhalaang,Hansal Mehta,Rajkummar RaoNushrat Bharucha,"T-Series, Luv Films, Ajay Devgn FFilms, Amazon Prime Video",[105]
88,NOV,13.0,Namumkin Tere Bin Jeena,Hidayat Khan,Anmol ChopraChristeenaBiju Rehana Khan,"Trisha Raj Films Pvt.Ltd, Zaid Corporation Company, Shamshad Pathan Films",[106]
89,NOV,13.0,Sir,Rohena Gera,Tillotama ShomeVivek Gomber,Platoon Films,[107]
90,NOV,15.0,Suraj Pe Mangal Bhari,Abhishek Sharma,Manoj BajpayeeDiljit DosanjhFatima Sana Shaikh,Zee Studios,[108]
91,NOV,20.0,Anwar Ka Ajab Kissa,Buddhadeb Dasgupta,Nawazuddin SiddiquiAnanya ChatterjeePankaj TripathiNiharika Singh,"Eros International, Eros Now",[109]
92,DEC,4.0,Darbaan,Bipin Nadkarni,Sharib HashmiSharad KelkarFlora SainiRasika Dugal,"Opticus Picture Company, ZEE5",[110]
93,DEC,11.0,Durgamati,G. Ashok,Bhumi PednekarArshad WarsiJisshu SenguptaMahie GillKaran Kapadia,"Abundantia Entertainment, T-Series, Cape of Good Films, Amazon Prime Video",[111]
94,DEC,11.0,Indoo Ki Jawani,Abir Sengupta,Kiara AdvaniAditya Seal,"T-Series, Emmay Entertainment, Electric Apples",[112]
95,DEC,11.0,Nirvana Inn,Vijay Jayapal,Adil HussainRajshri DeshpandeSandhya Mridul,"Stray Factory, Uncombed Buddha, Stop Whinging, Harman Ventures, Cinemapreneur",[113]
96,DEC,11.0,Torbaaz,Girish Malik,Sanjay DuttNargis FakhriRahul DevGavie ChahalRahul MittraPransh Chopra,"Clapstem Entertainment, Rahul Mittra Films, Netflix",[114]
97,DEC,18.0,Eeb Allay Ooo!,Prateek Vats,Shardul BharadwajMahender NathNutan SinhaShashi BhushanNaina Sareen,NaMa Productions,[115]
98,DEC,18.0,Sayonee,Nitin Kumar GuptaAbhay Singhal,Tanmay SsinghMusskan SethiRahul RoyYograj SinghUpasana Singh,"Lucky Nadiadwala Morani Productions, D&T Productions Pvt. Ltd.",[116]
99,DEC,18.0,Omprakash Zindabad,Ranjeet Gupta,Kulbhushan KharbandaJagdeepShweta BhardwajSeema AzmiAbhay JoshiIshtiyak KhanZakir HussainOm Puri,Panorama Studios,[117]
100,DEC,18.0,Unpaused,Raj & D.KNitya MehraNikkhil AdvaniTannishtha ChatterjeeAvinash Arun,Gulshan DevaiahSumeet VyasSaiyami KherRicha ChaddaAbhishek BanerjeeRatna Pathak ShahIshwak Singh,Amazon Prime Video,[118]
101,DEC,24.0,AK vs AK,Vikramaditya Motwane,Anil KapoorAnurag Kashyap,Netflix,[119]
102,DEC,25.0,Coolie No. 1,David Dhawan,Varun DhawanSara Ali Khan,"Pooja Entertainment, Amazon Prime Video",[105]
103,DEC,25.0,Shakeela,Indrajit Lankesh,Richa ChaddaPankaj TripathiRajeev Pillai,Sammy's Magic Cinema,[120]
